[
  {
    "sport": "chess",
    "tournament": "Sjakk-NM 2026 (Landsturneringen)",
    "title": "Sjakk-NM 2026 – eliteklassen",
    "time": "2026-07-03T16:00:00Z",
    "endTime": "2026-07-11T13:00:00Z",
    "venue": "Normoria, Kristiansund",
    "norwegian": true,
    "norwegianPlayers": [
      {
        "name": "Elham Amar"
      },
      {
        "name": "Jon Ludvig Hammer"
      },
      {
        "name": "Frode Olav Olsen Urkedal"
      },
      {
        "name": "Simen Agdestein"
      },
      {
        "name": "Aksel Bu Kvaløy"
      }
    ],
    "streaming": [
      {
        "platform": "Direktesport",
        "url": "https://www.direktesport.no"
      },
      {
        "platform": "Lichess",
        "url": "https://lichess.org"
      }
    ],
    "source": "ai-research",
    "researchedAt": "2026-07-04T21:14:40Z",
    "confidence": "high",
    "evidence": [
      "https://sjakknm2026.no/program.php",
      "https://sjakknm2026.no/newsArticle.php/2",
      "https://bergensjakk.no/2026/06/18/endringer-i-eliteklassen-i-landsturneringen-2026/",
      "https://sjakknm2026.no/"
    ],
    "summary": "Sjakk-NM 2026 – 100. utgave av Landsturneringen spilles i Normoria i Kristiansund 3.–11. juli. Aryan Tari trakk seg fra eliteklassen (erstattet av reserve); feltet toppes nå av Elham Amar og Jon Ludvig Hammer. Alle partier vises live på Direktesport (video med kommentar) og Lichess (~15 min forsinkelse). Én runde per dag, siste runde 11. juli.",
    "verifiedAt": "2026-07-05T08:27:09.000Z",
    "verificationStatus": "amended",
    "verificationSources": [
      "https://sjakknm2026.no/newsArticle.php/2",
      "https://bergensjakk.no/2026/07/04/landsturneringen-2026-dag-1/"
    ],
    "mustWatch": false,
    "id": "b5eda7054a5b",
    "participants": []
  },
  {
    "sport": "cycling",
    "tournament": "Tour de France 2026",
    "title": "Etappe 1 (lagtempo): Barcelona – Barcelona",
    "time": "2026-07-04T15:05:00Z",
    "endTime": "2026-07-04T17:15:00Z",
    "venue": "Barcelona, Spania",
    "norwegian": true,
    "norwegianPlayers": [
      {
        "name": "Tobias Halland Johannessen",
        "entityId": "tobias-halland-johannessen"
      },
      {
        "name": "Jonas Abrahamsen",
        "entityId": "jonas-abrahamsen"
      },
      {
        "name": "Søren Wærenskjold",
        "entityId": "soren-waerenskjold"
      },
      {
        "name": "Torstein Træen"
      },
      {
        "name": "Anders Skaarseth"
      }
    ],
    "streaming": [
      {
        "platform": "TV 2 Play",
        "url": "https://play.tv2.no/sport"
      }
    ],
    "source": "ai-research",
    "researchedAt": "2026-07-03T19:45:00Z",
    "confidence": "high",
    "evidence": [
      "https://en.wikipedia.org/wiki/2026_Tour_de_France",
      "https://www.cyclingstage.com/tour-de-france-2026-route/stage-1-tdf-2026/",
      "https://www.cyclingnews.com/pro-cycling/racing/tour-de-france-2026-stage-1-ttt-start-times/",
      "https://velo.outsideonline.com/road/road-racing/tour-de-france/tour-de-france-stage-1-team-time-trial-start-times/",
      "https://hjelp.tv2.no/hovedkategori/sport/tour-de-france"
    ],
    "summary": "Touren åpner med 19,7 km lagtempo i Barcelona – første lag ut kl. 17.05 lokal tid, Uno-X Mobility kl. 17.55. Tobias Halland Johannessen er Uno-X' sammenlagtkaptein med topp-5-ambisjoner.",
    "verifiedAt": "2026-07-04T13:30:00.000Z",
    "verificationStatus": "amended",
    "verificationSources": [
      "https://www.cyclingstage.com/tour-de-france-2026-route/stage-1-tdf-2026/",
      "https://www.tvkampen.com/sykling/tour-de-france",
      "https://www.m24.no/sportsrettigheter-sykkelritt-tour-de-france/tv-2-forlenger-tour-de-france-rettighetene-med-fem-ar/763578"
    ],
    "mustWatch": true,
    "id": "d8897faaae55",
    "participants": []
  },
  {
    "sport": "cycling",
    "tournament": "Tour de France 2026",
    "title": "Etappe 2: Tarragona – Barcelona",
    "time": "2026-07-05T11:45:00Z",
    "endTime": "2026-07-05T15:35:00Z",
    "venue": "Tarragona – Barcelona, Spania",
    "norwegian": true,
    "norwegianPlayers": [
      {
        "name": "Tobias Halland Johannessen",
        "entityId": "tobias-halland-johannessen"
      },
      {
        "name": "Jonas Abrahamsen",
        "entityId": "jonas-abrahamsen"
      },
      {
        "name": "Søren Wærenskjold",
        "entityId": "soren-waerenskjold"
      },
      {
        "name": "Torstein Træen"
      },
      {
        "name": "Anders Skaarseth"
      }
    ],
    "streaming": [
      {
        "platform": "TV 2 Play",
        "url": "https://play.tv2.no/sport"
      }
    ],
    "source": "ai-research",
    "researchedAt": "2026-07-03T19:45:00Z",
    "confidence": "medium",
    "evidence": [
      "https://en.wikipedia.org/wiki/2026_Tour_de_France",
      "https://www.cyclingstage.com/tour-de-france-2026-route/",
      "https://franceletour.com/tour-de-france-2026-schedule/",
      "https://hjelp.tv2.no/hovedkategori/sport/tour-de-france"
    ],
    "summary": "Kupert etappe (168,5 km) langs kysten til Montjuïc-runden i Barcelona – terreng som kan passe Uno-X' bruddryttere som Jonas Abrahamsen.",
    "verifiedAt": "2026-07-04T13:30:00.000Z",
    "verificationStatus": "amended",
    "verificationSources": [
      "https://www.cyclingstage.com/tour-de-france-2026-route/stage-2-tdf-2026/",
      "https://www.tvkampen.com/sykling/tour-de-france"
    ],
    "mustWatch": true,
    "id": "2c425475bf38",
    "participants": []
  },
  {
    "sport": "cycling",
    "tournament": "Tour de France 2026",
    "title": "Etappe 3 (fjell): Granollers – Les Angles",
    "time": "2026-07-06T10:10:00Z",
    "endTime": "2026-07-06T15:10:00Z",
    "venue": "Granollers, Spania – Les Angles, Frankrike",
    "norwegian": true,
    "norwegianPlayers": [
      {
        "name": "Tobias Halland Johannessen",
        "entityId": "tobias-halland-johannessen"
      },
      {
        "name": "Torstein Træen"
      },
      {
        "name": "Jonas Abrahamsen",
        "entityId": "jonas-abrahamsen"
      },
      {
        "name": "Anders Skaarseth"
      },
      {
        "name": "Søren Wærenskjold",
        "entityId": "soren-waerenskjold"
      }
    ],
    "streaming": [
      {
        "platform": "TV 2 Play",
        "url": "https://play.tv2.no/sport"
      }
    ],
    "source": "ai-research",
    "researchedAt": "2026-07-03T19:45:00Z",
    "confidence": "medium",
    "evidence": [
      "https://en.wikipedia.org/wiki/2026_Tour_de_France",
      "https://www.cyclingstage.com/tour-de-france-2026-route/",
      "https://franceletour.com/tour-de-france-2026-schedule/",
      "https://hjelp.tv2.no/hovedkategori/sport/tour-de-france"
    ],
    "summary": "Første fjelletappe (195,9 km, ca. 3850 høydemeter) med målgang oppover til Les Angles i de franske Pyreneene – første GC-test for Tobias Halland Johannessen.",
    "verifiedAt": "2026-07-04T13:30:00.000Z",
    "verificationStatus": "amended",
    "verificationSources": [
      "https://www.cyclingstage.com/tour-de-france-2026-route/stage-3-tdf-2026/",
      "https://www.tvkampen.com/sykling/tour-de-france"
    ],
    "mustWatch": true,
    "id": "eb28f1887c65",
    "participants": []
  },
  {
    "sport": "cycling",
    "tournament": "Tour de France 2026",
    "title": "Etappe 4: Carcassonne – Foix",
    "time": "2026-07-07T11:05:00Z",
    "endTime": "2026-07-07T15:30:00Z",
    "venue": "Carcassonne – Foix, Frankrike",
    "norwegian": true,
    "norwegianPlayers": [
      {
        "name": "Tobias Halland Johannessen",
        "entityId": "tobias-halland-johannessen"
      },
      {
        "name": "Jonas Abrahamsen",
        "entityId": "jonas-abrahamsen"
      },
      {
        "name": "Søren Wærenskjold",
        "entityId": "soren-waerenskjold"
      },
      {
        "name": "Torstein Træen"
      },
      {
        "name": "Anders Skaarseth"
      }
    ],
    "streaming": [
      {
        "platform": "TV 2 Play",
        "url": "https://play.tv2.no/sport"
      }
    ],
    "source": "ai-research",
    "researchedAt": "2026-07-03T19:45:00Z",
    "confidence": "medium",
    "evidence": [
      "https://en.wikipedia.org/wiki/2026_Tour_de_France",
      "https://www.cyclingstage.com/tour-de-france-2026-route/",
      "https://franceletour.com/tour-de-france-2026-schedule/",
      "https://hjelp.tv2.no/hovedkategori/sport/tour-de-france"
    ],
    "summary": "Kupert overgangsetappe Carcassonne–Foix (181,9 km) – typisk bruddterreng der Uno-X har varslet offensiv kjøring.",
    "verifiedAt": "2026-07-04T13:30:00.000Z",
    "verificationStatus": "amended",
    "verificationSources": [
      "https://www.cyclingstage.com/tour-de-france-2026-route/stage-4-tdf-2026/",
      "https://www.tvkampen.com/sykling/tour-de-france"
    ],
    "mustWatch": true,
    "id": "0f81d1da2026",
    "participants": []
  },
  {
    "sport": "cycling",
    "tournament": "Tour de France 2026",
    "title": "Etappe 5: Lannemezan – Pau",
    "time": "2026-07-08T12:05:00Z",
    "endTime": "2026-07-08T15:45:00Z",
    "venue": "Lannemezan – Pau, Frankrike",
    "norwegian": true,
    "norwegianPlayers": [
      {
        "name": "Søren Wærenskjold",
        "entityId": "soren-waerenskjold"
      },
      {
        "name": "Tobias Halland Johannessen",
        "entityId": "tobias-halland-johannessen"
      },
      {
        "name": "Jonas Abrahamsen",
        "entityId": "jonas-abrahamsen"
      },
      {
        "name": "Torstein Træen"
      },
      {
        "name": "Anders Skaarseth"
      }
    ],
    "streaming": [
      {
        "platform": "TV 2 Play",
        "url": "https://play.tv2.no/sport"
      }
    ],
    "source": "ai-research",
    "researchedAt": "2026-07-03T19:45:00Z",
    "confidence": "medium",
    "evidence": [
      "https://en.wikipedia.org/wiki/2026_Tour_de_France",
      "https://www.cyclingstage.com/tour-de-france-2026-route/",
      "https://franceletour.com/tour-de-france-2026-schedule/",